{"gateway_path":{"bundle_fp":"sha256:8426d5ed423149665f5786b274cf8176807a493603860a755822012a68d1c6e0","events_ranked_top3":["sales#e-sales-alias-eng-010","eng#e-eng-002","eng#e-eng-001"],"orientation_counts":{"preceding":2,"succeeding":2},"selector_policy_id":"sim_desc__ts_iso_desc__id_asc","templater":{"mode":"deterministic","template_version":"v3-blocks"},"validation":{"error_count":0}},"request":{"anchor_id":"eng#d-eng-010","intent":"why_decision","request_id":"c9c22e20d96b4a69","trace_id":null,"ts_utc":"2025-11-02T16:55:15Z"},"response_preview":{"blocks":{"decision_id":"eng#d-eng-010","description":"Select and integrate Stripe to support EU billing and VAT handling for the Q4 launch","key_events":["eng#e-eng-002","eng#e-eng-001"],"lead":"Sam Rivera on 2025-08-15: Adopt Stripe for EU billing.","next":"eng#d-eng-011","owner":{"name":"Sam Rivera","role":"VP Engineering"}},"completeness_flags":{"event_count":3,"has_preceding":true,"has_succeeding":true}},"validator":{}}
